{
  "format_version": 1,
  "kind": "context-selection-trace",
  "id": "context-trace:no-memory-replay",
  "request_ref": "context-request:remote-review",
  "input_fingerprint": "sha256:dddddddddddddddddddddddddddddddddddddddddddddddddddddddddddddddd",
  "selector": {
    "id": "context-gateway",
    "version": "1.0.0",
    "deterministic": true
  },
  "candidates": [
    {
      "id": "candidate:project-truth",
      "source": {
        "kind": "project-truth",
        "reference": "AGENTS.md",
        "digest": "sha256:aaaaaaaaaaaaaaaaaaaaaaaaaaaaaaaaaaaaaaaaaaaaaaaaaaaaaaaaaaaaaaaa",
        "revision": "main",
        "retrieval": {
          "kind": "direct",
          "query_ref": null,
          "provider_ref": null,
          "result_digest": null
        }
      },
      "authority": "project-truth",
      "mandatory": true,
      "sensitivity": "project",
      "freshness": "current",
      "estimated_tokens": 120,
      "stages": [
        {
          "stage": "mandatory-policy",
          "disposition": "included",
          "reason": "Project-authored mandatory truth is always included.",
          "score": null,
          "decision": null
        }
      ],
      "final_disposition": "included",
      "reasons": [
        "mandatory-project-truth"
      ]
    },
    {
      "id": "candidate:context-doc",
      "source": {
        "kind": "repository-evidence",
        "reference": ".agentic/docs/architecture/context-compiler.md",
        "digest": "sha256:bbbbbbbbbbbbbbbbbbbbbbbbbbbbbbbbbbbbbbbbbbbbbbbbbbbbbbbbbbbbbbbb",
        "revision": "main",
        "retrieval": {
          "kind": "repository-search",
          "query_ref": "repo-query:context",
          "provider_ref": "repository-index:v1",
          "result_digest": "sha256:cccccccccccccccccccccccccccccccccccccccccccccccccccccccccccccccc"
        }
      },
      "authority": "repository-evidence",
      "mandatory": false,
      "sensitivity": "project",
      "freshness": "current",
      "estimated_tokens": 160,
      "stages": [
        {
          "stage": "scope-filter",
          "disposition": "candidate",
          "reason": "The file is inside the task path scope.",
          "score": null,
          "decision": null
        },
        {
          "stage": "lexical",
          "disposition": "included",
          "reason": "The task directly names context compilation.",
          "score": {
            "value": 31,
            "method": "lexical-v1",
            "confidence": null
          },
          "decision": null
        }
      ],
      "final_disposition": "included",
      "reasons": [
        "task-scope",
        "lexical-match"
      ]
    }
  ],
  "budget": {
    "input_limit": 500,
    "allocations": [
      {
        "kind": "mandatory_project_truth",
        "limit": null,
        "estimated_selected": 120
      },
      {
        "kind": "repository_evidence",
        "limit": 200,
        "estimated_selected": 160
      },
      {
        "kind": "project_memory",
        "limit": 150,
        "estimated_selected": 0
      },
      {
        "kind": "execution_evidence",
        "limit": 75,
        "estimated_selected": 0
      },
      {
        "kind": "generated_compression",
        "limit": 75,
        "estimated_selected": 0
      }
    ],
    "estimated_selected": 280,
    "over_budget": false
  },
  "token_usage": {
    "estimated": {
      "input": 280,
      "tool_output": null,
      "output": null
    },
    "observed": {
      "input": null,
      "tool_output": null,
      "output": null
    },
    "observed_source_ref": null
  },
  "selection_fingerprint": "sha256:eeeeeeeeeeeeeeeeeeeeeeeeeeeeeeeeeeeeeeeeeeeeeeeeeeeeeeeeeeeeeeee",
  "compiled_plan_ref": "compiled-context:no-memory",
  "complete": true,
  "not_checked": [
    "provider tokenizer usage"
  ]
}
