{
  "format_version": 1,
  "kind": "context-selection-trace",
  "id": "context-trace:conflicting-memory",
  "request_ref": "context-request:remote-review",
  "input_fingerprint": "sha256:bbbbbbbbbbbbbbbbbbbbbbbbbbbbbbbbbbbbbbbbbbbbbbbbbbbbbbbbbbbbbbbb",
  "selector": {
    "id": "context-gateway",
    "version": "1.0.0",
    "deterministic": true
  },
  "candidates": [
    {
      "id": "candidate:project-truth",
      "source": {
        "kind": "project-truth",
        "reference": "AGENTS.md",
        "digest": "sha256:aaaaaaaaaaaaaaaaaaaaaaaaaaaaaaaaaaaaaaaaaaaaaaaaaaaaaaaaaaaaaaaa",
        "revision": "main",
        "retrieval": {
          "kind": "direct",
          "query_ref": null,
          "provider_ref": null,
          "result_digest": null
        }
      },
      "authority": "project-truth",
      "mandatory": true,
      "sensitivity": "project",
      "freshness": "current",
      "estimated_tokens": 120,
      "stages": [
        {
          "stage": "mandatory-policy",
          "disposition": "included",
          "reason": "Project-authored mandatory truth is always included.",
          "score": null,
          "decision": null
        }
      ],
      "final_disposition": "included",
      "reasons": [
        "mandatory-project-truth"
      ]
    },
    {
      "id": "candidate:conflict-a",
      "source": {
        "kind": "project-memory",
        "reference": "memory:conflict:a",
        "digest": "sha256:dddddddddddddddddddddddddddddddddddddddddddddddddddddddddddddddd",
        "revision": "2026-09-20T00:00:00Z",
        "retrieval": {
          "kind": "memory-query",
          "query_ref": "memory-query:context-rules",
          "provider_ref": "memory-provider:remote-service",
          "result_digest": "sha256:7777777777777777777777777777777777777777777777777777777777777777"
        }
      },
      "authority": "project-memory",
      "mandatory": false,
      "sensitivity": "project",
      "freshness": "current",
      "estimated_tokens": 70,
      "stages": [
        {
          "stage": "scope-filter",
          "disposition": "candidate",
          "reason": "Memory matches project and context scope.",
          "score": null,
          "decision": null
        },
        {
          "stage": "semantic-search",
          "disposition": "candidate",
          "reason": "Semantic retrieval found a task-relevant cache-policy memory.",
          "score": {
            "value": 0.8,
            "method": "memory-semantic-v1",
            "confidence": 0.86
          },
          "decision": null
        },
        {
          "stage": "typed-decision",
          "disposition": "deferred",
          "reason": "The typed relevance decision is advisory and policy requires review because retrieved memories conflict.",
          "score": null,
          "decision": {
            "receipt_ref": "decision-receipt:context-a",
            "status": "produced",
            "provider": {
              "type": "jev",
              "id": "typesafe-jev",
              "model": "context-relevance",
              "version": "1"
            },
            "provider_confidence": 0.62,
            "distribution": {
              "include": 0.61,
              "defer": 0.39
            },
            "policy_disposition": "review",
            "advisory": true
          }
        }
      ],
      "final_disposition": "deferred",
      "reasons": [
        "conflicting-memory",
        "semantic-decision-advisory",
        "review-required"
      ]
    },
    {
      "id": "candidate:conflict-b",
      "source": {
        "kind": "project-memory",
        "reference": "memory:conflict:b",
        "digest": "sha256:eeeeeeeeeeeeeeeeeeeeeeeeeeeeeeeeeeeeeeeeeeeeeeeeeeeeeeeeeeeeeeee",
        "revision": "2026-09-20T00:00:00Z",
        "retrieval": {
          "kind": "memory-query",
          "query_ref": "memory-query:context-rules",
          "provider_ref": "memory-provider:remote-service",
          "result_digest": "sha256:7777777777777777777777777777777777777777777777777777777777777777"
        }
      },
      "authority": "project-memory",
      "mandatory": false,
      "sensitivity": "project",
      "freshness": "current",
      "estimated_tokens": 70,
      "stages": [
        {
          "stage": "scope-filter",
          "disposition": "candidate",
          "reason": "Memory matches project and context scope.",
          "score": null,
          "decision": null
        },
        {
          "stage": "semantic-search",
          "disposition": "candidate",
          "reason": "Semantic retrieval found a task-relevant cache-policy memory.",
          "score": {
            "value": 0.8,
            "method": "memory-semantic-v1",
            "confidence": 0.86
          },
          "decision": null
        },
        {
          "stage": "typed-decision",
          "disposition": "deferred",
          "reason": "The typed relevance decision is advisory and policy requires review because retrieved memories conflict.",
          "score": null,
          "decision": {
            "receipt_ref": "decision-receipt:context-b",
            "status": "produced",
            "provider": {
              "type": "jev",
              "id": "typesafe-jev",
              "model": "context-relevance",
              "version": "1"
            },
            "provider_confidence": 0.58,
            "distribution": {
              "include": 0.55,
              "defer": 0.45
            },
            "policy_disposition": "review",
            "advisory": true
          }
        }
      ],
      "final_disposition": "deferred",
      "reasons": [
        "conflicting-memory",
        "semantic-decision-advisory",
        "review-required"
      ]
    }
  ],
  "budget": {
    "input_limit": 500,
    "allocations": [
      {
        "kind": "mandatory_project_truth",
        "limit": null,
        "estimated_selected": 120
      },
      {
        "kind": "repository_evidence",
        "limit": 200,
        "estimated_selected": 0
      },
      {
        "kind": "project_memory",
        "limit": 150,
        "estimated_selected": 0
      },
      {
        "kind": "execution_evidence",
        "limit": 75,
        "estimated_selected": 0
      },
      {
        "kind": "generated_compression",
        "limit": 75,
        "estimated_selected": 0
      }
    ],
    "estimated_selected": 120,
    "over_budget": false
  },
  "token_usage": {
    "estimated": {
      "input": 120,
      "tool_output": null,
      "output": null
    },
    "observed": {
      "input": null,
      "tool_output": null,
      "output": null
    },
    "observed_source_ref": null
  },
  "selection_fingerprint": "sha256:cccccccccccccccccccccccccccccccccccccccccccccccccccccccccccccccc",
  "compiled_plan_ref": "compiled-context:conflicting-memory",
  "complete": true,
  "not_checked": [
    "provider tokenizer usage"
  ]
}
